{
  "draftVersion": "1210-3",
  "sessionID": "example-java-session",
  "revision": 1,
  "capabilities": {
    "sourceBreakpoints": {
      "state": "unknown",
      "source": "dap",
      "reason": "not_negotiated"
    },
    "hotCodeReplace": {
      "state": "unknown",
      "source": "backend",
      "reason": "not_negotiated",
      "provider": {
        "pluginID": "example.java-runtime",
        "export": "hotCodeReplace"
      }
    }
  }
}
